response.url;result.mixed_content_url;result.canonical;result.is_canonical;previousUrl;depth;result.error;response.status;result.x_cache;result.request_time;result.redirected_from;result.redirects;result.title;result.h1;result.page_date;result.description;result.keywords;result.og_title;result.og_image;result.schema_types;result.h1_count;result.h2_count;result.h3_count;result.h4_count;result.canonical_count;result.google_amp;result.images;result.images_without_alt;result.images_alt_empty;result.images_outer;result.links;result.links_inner;result.links_outer;result.text_ratio_percent;result.dom_size;result.html_size;readability_length;readability_words;readability_minutes;readability_links;readability_links_inner;readability_links_outer;links_anchors;readability_images;readability_images_png;readability_images_png_links;yake_keywords;yake_detectedLanguage;lighthouse.scores.performance;lighthouse.scores.pwa;lighthouse.scores.accessibility;lighthouse.scores.best-practices;lighthouse.scores.seo;lighthouse.first-contentful-paint;lighthouse.speed-index;lighthouse.largest-contentful-paint;lighthouse.interactive;lighthouse.total-blocking-time;lighthouse.cumulative-layout-shift;lighthouse.first-cpu-idle;lighthouse.max-potential-fid;lighthouse.first-meaningful-paint;lighthouse.estimated-input-latency;lighthouse.render-blocking-resources;lighthouse.uses-responsive-images;lighthouse.offscreen-images;lighthouse.unminified-css;lighthouse.unminified-javascript;lighthouse.unused-css-rules;lighthouse.unused-javascript;lighthouse.uses-optimized-images;lighthouse.uses-webp-images;lighthouse.uses-text-compression;lighthouse.uses-rel-preconnect;lighthouse.server-response-time;lighthouse.redirects;lighthouse.uses-rel-preload;lighthouse.uses-http2;lighthouse.efficient-animated-content;lighthouse.duplicated-javascript;lighthouse.legacy-javascript;lighthouse.total-byte-weight;lighthouse.uses-long-cache-ttl;lighthouse.dom-size;lighthouse.critical-request-chains;lighthouse.user-timings;lighthouse.bootup-time;lighthouse.mainthread-work-breakdown;lighthouse.font-display;lighthouse.performance-budget;lighthouse.timing-budget;lighthouse.resource-summary;lighthouse.third-party-summary;lighthouse.largest-contentful-paint-element;lighthouse.layout-shift-elements;lighthouse.uses-passive-event-listeners;lighthouse.no-document-write;lighthouse.long-tasks;lighthouse.non-composited-animations;lighthouse.unsized-images;lighthouse.network-requests;lighthouse.network-rtt;lighthouse.network-server-latency;lighthouse.main-thread-tasks;lighthouse.diagnostics;lighthouse.metrics;lighthouse.screenshot-thumbnails;lighthouse.final-screenshot;lighthouse.accesskeys;lighthouse.aria-allowed-attr;lighthouse.aria-hidden-body;lighthouse.aria-hidden-focus;lighthouse.aria-input-field-name;lighthouse.aria-required-attr;lighthouse.aria-required-children;lighthouse.aria-required-parent;lighthouse.aria-roles;lighthouse.aria-toggle-field-name;lighthouse.aria-valid-attr-value;lighthouse.aria-valid-attr;lighthouse.button-name;lighthouse.bypass;lighthouse.color-contrast;lighthouse.definition-list;lighthouse.dlitem;lighthouse.document-title;lighthouse.duplicate-id-active;lighthouse.duplicate-id-aria;lighthouse.form-field-multiple-labels;lighthouse.frame-title;lighthouse.heading-order;lighthouse.html-has-lang;lighthouse.html-lang-valid;lighthouse.image-alt;lighthouse.input-image-alt;lighthouse.label;lighthouse.layout-table;lighthouse.link-name;lighthouse.list;lighthouse.listitem;lighthouse.meta-refresh;lighthouse.meta-viewport;lighthouse.object-alt;lighthouse.tabindex;lighthouse.td-headers-attr;lighthouse.th-has-data-cells;lighthouse.valid-lang;lighthouse.video-caption;lighthouse.video-description;lighthouse.logical-tab-order;lighthouse.focusable-controls;lighthouse.interactive-element-affordance;lighthouse.managed-focus;lighthouse.focus-traps;lighthouse.custom-controls-labels;lighthouse.custom-controls-roles;lighthouse.visual-order-follows-dom;lighthouse.offscreen-content-hidden;lighthouse.use-landmarks;lighthouse.is-on-https;lighthouse.external-anchors-use-rel-noopener;lighthouse.geolocation-on-start;lighthouse.notification-on-start;lighthouse.no-vulnerable-libraries;lighthouse.password-inputs-can-be-pasted-into;lighthouse.image-aspect-ratio;lighthouse.image-size-responsive;lighthouse.doctype;lighthouse.charset;lighthouse.no-unload-listeners;lighthouse.appcache-manifest;lighthouse.js-libraries;lighthouse.deprecations;lighthouse.errors-in-console;lighthouse.viewport;lighthouse.meta-description;lighthouse.http-status-code;lighthouse.link-text;lighthouse.crawlable-anchors;lighthouse.is-crawlable;lighthouse.robots-txt;lighthouse.hreflang;lighthouse.canonical;lighthouse.font-size;lighthouse.plugins;lighthouse.tap-targets;lighthouse.structured-data;lighthouse.load-fast-enough-for-pwa;lighthouse.works-offline;lighthouse.offline-start-url;lighthouse.service-worker;lighthouse.installable-manifest;lighthouse.redirects-http;lighthouse.splash-screen;lighthouse.themed-omnibox;lighthouse.content-width;lighthouse.without-javascript;lighthouse.apple-touch-icon;lighthouse.maskable-icon;lighthouse.pwa-cross-browser;lighthouse.pwa-page-transitions;lighthouse.pwa-each-page-has-url
https://flybitlux.com/;;https://flybitlux.com/;0;;1;;200;0;86;;0;Private Jet Charter | Private Jet Rental | BitLux;Private Jet Charter;;Bitlux is a private jet rental company that offers private jet charter with the highest standards of safety & luxury. Call now & take your next flight in style.;;Private Jet Charter | Private Jet Rental Company | BitLux;https://flybitlux.com/wp-content/uploads/2024/11/social-share-image.jpg;;1;10;22;14;1;0;19;0;3;0;237;227;4;6;1526;693390;;;;;;;;;;;;;0;0;0;100;0;2130;2512;3331;2130;1;0;;46;2130;;741;300;1;1;1;0.5;1;1;;1;1;28;1;;1;1;1;0.5;1617609;4639;1845;1;;288;1680;1;;;1;1;0;0;1;1;1;;1;1;175;30;1;1;2131;1;1;;1;1;1;;1;;;1;;1;1;1;;0;;;1;;;;;0;1;1;1;;;;0;1;1;;1;;1;;;;;;;;;;;;;;;;1;;1;1;;;1;1;1;1;1;;1;1;1;1;1;1;1;0;1;1;1;1;1;1;1;;;;;;1;;0;0;1;;;0;;;
https://flybitlux.com/about/services/;;https://flybitlux.com/about/services/;1;https://flybitlux.com/#booking;2;;200;0;37;;0;Services | Bitlux;Services We Offer;;Experience the convenience and luxury of private jet charter. With reliable and secure aircraft, you can book a wide variety of flights. Book with Bitlux now.;;Services | Bitlux;https://flybitlux.com/wp-content/uploads/2024/11/social-share-image.jpg;;1;5;3;6;1;0;5;0;3;0;225;217;4;3;945;558698;;;;;;;;;;;;;0;0;0;100;0;2278;2278;4378;2578;1;0;;47;2578;;1093;1;1;1;1;150;1;1;;1;1;33;1;;1;1;1;0.5;1202718;4524;1272;1;;104;674;1;;;1;1;0;1;1;1;1;;1;1;0;177;1;1;2579;1;1;;1;1;1;;1;;;1;;1;1;1;;0;;;1;;;;;1;1;1;1;;;;0;1;1;;1;;1;;;;;;;;;;;;;;;;1;;1;1;;;1;1;1;1;1;;1;1;1;1;1;1;0;0;1;1;1;1;1;1;1;;;;;;1;;0;0;1;;;0;;;
https://flybitlux.com/book-your-flight/;;;;https://flybitlux.com/#booking;2;;200;0;54;;0;Book Your Flight | BitLux;Book A Private Jet Charter Anywhere In The World;;Get a quotes for private & executive air charter flights. BitLux offers the best price, service and aircraft worldwide. 1-866-451-0599;;Book Your Flight | BitLux;https://flybitlux.com/wp-content/uploads/2024/11/social-share-image.jpg;;1;8;6;5;0;0;11;0;3;0;240;232;4;2;1217;624079;;;;;;;;;;;;;0;0;0;100;0;2128;2128;2803;2128;1;0;;39;2128;;922;1;1;1;1;0;1;1;;1;1;27;1;;1;1;1;0.5;298891;4530;1545;1;;101;780;1;;;1;1;0;1;1;1;1;;1;1;0;181;1;1;2128;1;1;;1;1;1;;1;;;1;;1;1;1;;0;;;1;;;;;0;1;1;1;;;;0;1;1;;1;;1;;;;;;;;;;;;;;;;1;;1;1;;;1;1;1;1;1;;1;1;1;1;1;1;1;0;0;1;1;;1;1;1;;;;;;1;;0;0;1;;;0;;;
https://flybitlux.com/aircraft-management-and-placement/;;https://flybitlux.com/aircraft-management-and-placement/;1;https://flybitlux.com/#booking;2;;200;0;66;;0;Aircraft Management And Placement | BitLux;Aircraft Management;;BitLux Travel offers private aircraft management and jet placement services in many cities nationwide. Contact us today for a quote.;;Aircraft Management And Placement | BitLux;https://flybitlux.com/wp-content/uploads/2024/11/social-share-image.jpg;;1;3;4;6;1;0;5;0;3;0;218;208;4;4;935;545472;;;;;;;;;;;;;0;0;0;100;0;2128;2128;3703;2128;1;0;;42;2128;;967;1;1;1;1;300;1;1;;1;1;25;1;;1;1;1;0.5;541939;4597;1262;1;;98;629;1;;;1;1;0;1;1;1;1;1;1;1;0;180;1;1;2129;1;1;;1;1;1;;1;;;1;;1;1;1;;0;;;1;;;;;0;1;1;1;;;;0;1;1;;1;;1;;;;;;;;;;;;;;;;1;;1;1;;;1;1;1;1;1;;1;1;1;1;1;1;1;0;1;1;1;1;1;1;1;;;;;;1;;0;0;1;;;0;;;
https://flybitlux.com/cargo-jet-charter/;;https://flybitlux.com/cargo-jet-charter/;1;https://flybitlux.com/#booking;2;;200;0;43;;0;Cargo Jet Charter | Air Freight Services | BitLux;Bitlux Air Cargo Jet Charter;;We specialize in Air Cargo Jet Charters, supply chain logistics, air cargo logistics, and emergency cargo transport. Get a quote today.;;Cargo Jet Charter | Air Freight Services | BitLux;https://flybitlux.com/wp-content/uploads/2024/11/social-share-image.jpg;;1;9;7;12;1;0;11;0;3;0;215;207;4;6;1247;625920;;;;;;;;;;;;;0;0;0;100;0;1846;1846;2804;1846;1;0;;36;1846;;640;1;1;1;1;0;1;1;;1;1;25;1;;1;1;1;0.5;567987;4532;1570;1;;90;788;1;;;1;1;0;1;1;1;1;1;1;1;0;179;1;1;1846;1;1;;1;1;1;;1;;;1;;1;1;1;;0;;;1;;;;;0;1;1;1;;1;;0;1;1;;1;;1;;;;;;;;;;;;;;;;1;;1;1;;;1;1;1;1;1;;1;1;1;1;1;1;1;0;1;1;1;1;1;1;1;;;;;;1;;0;0;1;;;0;;;
https://flybitlux.com/helicopter-charter/;;https://flybitlux.com/helicopter-charter/;1;https://flybitlux.com/#booking;2;;200;0;47;;0;Helicopter Charter Services | BitLux;Bitlux Helicopter Charter;;At BitLux, we continually keep record of all of our client preferences – from aircraft preferences, cargo dimensions, palletizing practices, load, handling preferences, and carrier preferences.;;Helicopter Charter Services | BitLux;https://flybitlux.com/wp-content/uploads/2024/11/social-share-image.jpg;;1;5;2;6;1;0;5;0;3;0;212;204;4;4;914;544029;;;;;;;;;;;;;0;0;0;100;0;2128;2128;3478;2277;4;0;;59;2128;;968;1;1;1;1;300;1;1;;1;1;28;1;;1;1;1;0.5;575018;4545;1241;1;;163;670;1;;;1;1;0;1;1;1;1;1;1;1;0;177;1;1;2278;1;1;;1;1;1;;1;;;1;;1;1;1;;0;;;1;;;;;0;1;1;1;;;;0;1;1;;1;;1;;;;;;;;;;;;;;;;1;;1;1;;;1;1;1;1;1;;1;1;1;1;1;1;1;0;1;1;1;1;1;1;1;;;;;;1;;0;0;1;;;0;;;
